{
  "@context": "http://qiicr.org/dcmqi/contexts/dcmqi.jsonld",
  "id": "https://raw.githubusercontent.com/qiicr/dcmqi/master/doc/schemas/seg-schema.json#",
  "$schema": "http://json-schema.org/draft-04/schema#",
  "additionalProperties": false,
  "properties": {
    "@schema": {"type" : "string"},
    "ContentCreatorName": {
      "allOf": [
        {
          "$ref": "https://raw.githubusercontent.com/qiicr/dcmqi/master/doc/schemas/common-schema.json#/definitions/PN"
        }
      ],
      "default": "Reader1"
    },
    "ClinicalTrialSeriesID": {
      "allOf": [
        {
          "$ref": "https://raw.githubusercontent.com/qiicr/dcmqi/master/doc/schemas/common-schema.json#/definitions/LO"
        }
      ],
      "default": "Session1"
    },
    "ContentLabel": {
      "allOf": [
        {
          "$ref": "https://raw.githubusercontent.com/qiicr/dcmqi/master/doc/schemas/common-schema.json#/definitions/CS"
        }
      ],
      "default": "SEGMENTATION"
    },
    "ContentDescription": {
      "allOf": [
        {
          "$ref": "https://raw.githubusercontent.com/qiicr/dcmqi/master/doc/schemas/common-schema.json#/definitions/LO"
        }
      ],
      "default": "Image segmentation"
    },
    "ClinicalTrialCoordinatingCenterName": {
      "allOf": [
        {
          "$ref": "https://raw.githubusercontent.com/qiicr/dcmqi/master/doc/schemas/common-schema.json#/definitions/LO"
        }
      ],
      "default": "dcmqi"
    },
    "ClinicalTrialTimePointID": {
      "allOf": [
        {
          "$ref": "https://raw.githubusercontent.com/qiicr/dcmqi/master/doc/schemas/common-schema.json#/definitions/LO"
        }
      ],
      "default": "1"
    },
    "SeriesDescription": {
      "allOf": [
        {
          "$ref": "https://raw.githubusercontent.com/qiicr/dcmqi/master/doc/schemas/common-schema.json#/definitions/LO"
        }
      ],
      "default": "Segmentation"
    },
    "SeriesNumber": {
      "allOf": [
        {
          "$ref": "https://raw.githubusercontent.com/qiicr/dcmqi/master/doc/schemas/common-schema.json#/definitions/IS"
        }
      ],
      "default": "300"
    },
    "InstanceNumber": {
      "allOf": [
        {
          "$ref": "https://raw.githubusercontent.com/qiicr/dcmqi/master/doc/schemas/common-schema.json#/definitions/IS"
        }
      ],
      "default": "1"
    },
    "BodyPartExamined": {
      "allOf": [
        {
          "$ref": "https://raw.githubusercontent.com/qiicr/dcmqi/master/doc/schemas/common-schema.json#/definitions/CS"
        }
      ],
      "default": ""
    },
    "segmentAttributesFileMapping": {
      "type": "array",
      "items": {
        "type": "string"
      }
    },
    "segmentAttributes": {
      "type": "array",
      "items": {
        "type": "array",
        "items": {
          "type": "object",
          "additionalProperties": false,
          "required": [
            "labelID",
            "SegmentedPropertyCategoryCodeSequence",
            "SegmentedPropertyTypeCodeSequence",
            "SegmentAlgorithmType"
          ],
          "properties": {
            "labelID": {
              "type": "integer",
              "default": 1
            },
            "SegmentDescription": {
              "type": "string"
            },
            "SegmentedPropertyCategoryCodeSequence": {
              "allOf": [
                {
                  "$ref": "https://raw.githubusercontent.com/qiicr/dcmqi/master/doc/schemas/common-schema.json#/definitions/codeSequence"
                }
              ],
              "default": {
                "CodeValue": "T-D0050",
                "CodingSchemeDesignator": "SRT",
                "CodeMeaning": "Tissue"
              }
            },
            "SegmentedPropertyTypeCodeSequence": {
              "allOf": [
                {
                  "$ref": "https://raw.githubusercontent.com/qiicr/dcmqi/master/doc/schemas/common-schema.json#/definitions/codeSequence"
                }
              ],
              "default": {
                "CodeValue": "T-D0050",
                "CodingSchemeDesignator": "SRT",
                "CodeMeaning": "Tissue"
              }
            },
            "SegmentedPropertyTypeModifierCodeSequence": {
              "$ref": "https://raw.githubusercontent.com/qiicr/dcmqi/master/doc/schemas/common-schema.json#/definitions/codeSequence"
            },
            "AnatomicRegionSequence": {
              "$ref": "https://raw.githubusercontent.com/qiicr/dcmqi/master/doc/schemas/common-schema.json#/definitions/codeSequence"
            },
            "AnatomicRegionModifierSequence": {
              "$ref": "https://raw.githubusercontent.com/qiicr/dcmqi/master/doc/schemas/common-schema.json#/definitions/codeSequence"
            },
            "SegmentAlgorithmType": {
              "allOf": [
                {
                  "$ref": "https://raw.githubusercontent.com/qiicr/dcmqi/master/doc/schemas/common-schema.json#/definitions/CS"
                },
                {
                  "enum": [
                    "AUTOMATIC",
                    "MANUAL",
                    "SEMIAUTOMATIC"
                  ]
                }
              ],
              "default": "SEMIAUTOMATIC"
            },
            "SegmentAlgorithmName": {
              "$ref": "https://raw.githubusercontent.com/qiicr/dcmqi/master/doc/schemas/common-schema.json#/definitions/LO"
            },
            "recommendedDisplayRGBValue": {
              "$ref": "https://raw.githubusercontent.com/qiicr/dcmqi/master/doc/schemas/common-schema.json#/definitions/RGB"
            },
            "RecommendedDisplayCIELabValue": {
              "$ref": "https://raw.githubusercontent.com/qiicr/dcmqi/master/doc/schemas/common-schema.json#/definitions/CIELab"
            }
          }
        }
      }
    }
  }
}
